{
  "schema_version": "1.1",
  "id": "nyc-city-council",
  "title": "NYC City Council (partner-supplied)",
  "version": "0.1.0",
  "role": "personalized",
  "in_basis": false,
  "summary": "Constitution supplied by the New York City Council for a bespoke character-training engagement.",
  "criteria": [
    "Criterion 1 (PLACEHOLDER — supplied by partner; do not author on their behalf)"
  ],
  "license": "See partner.terms",
  "partner": {
    "name": "New York City Council",
    "supplied_by": "New York City Council",
    "engagement": "Character-train a Qwen model on the Council-supplied constitution.",
    "usage": "Character-training target; scored against the anchor basis as a user submission.",
    "terms": "PLACEHOLDER — record the partner's licensing/usage/confidentiality terms here before publishing."
  },
  "provenance": {
    "method": "partner-supplied",
    "date": "2026-06-14"
  },
  "changelog": [
    {
      "version": "0.1.0",
      "date": "2026-06-14",
      "notes": "Stub awaiting partner-supplied text and terms."
    }
  ]
}